{
  "$id": "gts://gts.frontx.mfes.ext.domain.v1~",
  "$schema": "https://json-schema.org/draft/2020-12/schema",
  "type": "object",
  "properties": {
    "id": {
      "x-gts-ref": "/$id",
      "$comment": "The GTS type ID for this instance"
    },
    "sharedProperties": {
      "type": "array",
      "items": { "x-gts-ref": "gts.frontx.mfes.comm.shared_property.v1~*" }
    },
    "actions": {
      "type": "array",
      "items": { "x-gts-ref": "gts.frontx.mfes.comm.action.v1~*" },
      "$comment": "Action type IDs that can target extensions in this domain"
    },
    "extensionsActions": {
      "type": "array",
      "items": { "x-gts-ref": "gts.frontx.mfes.comm.action.v1~*" },
      "$comment": "Action type IDs extensions can send when targeting this domain"
    },
    "extensionsTypeId": {
      "type": "string",
      "x-gts-ref": "gts.frontx.mfes.ext.extension.v1~*",
      "$comment": "Optional reference to a derived Extension type ID. If specified, extensions must use types that derive from this type."
    },
    "defaultActionTimeout": {
      "type": "number",
      "minimum": 1,
      "$comment": "Default timeout in milliseconds for actions targeting this domain. REQUIRED."
    },
    "lifecycleStages": {
      "type": "array",
      "items": { "x-gts-ref": "gts.frontx.mfes.lifecycle.stage.v1~*" },
      "$comment": "Lifecycle stage type IDs supported for the domain itself. Hooks referencing unsupported stages are rejected during validation."
    },
    "extensionsLifecycleStages": {
      "type": "array",
      "items": { "x-gts-ref": "gts.frontx.mfes.lifecycle.stage.v1~*" },
      "$comment": "Lifecycle stage type IDs supported for extensions in this domain. Extension hooks referencing unsupported stages are rejected during validation."
    },
    "lifecycle": {
      "type": "array",
      "items": { "type": "object", "$ref": "gts://gts.frontx.mfes.lifecycle.hook.v1~" },
      "$comment": "Optional lifecycle hooks - explicitly declared actions for each stage"
    }
  },
  "required": ["id", "sharedProperties", "actions", "extensionsActions", "defaultActionTimeout", "lifecycleStages", "extensionsLifecycleStages"]
}
