{
  "id": "gts.frontx.mfes.ext.domain.v1~frontx.screensets.layout.screen.v1",
  "sharedProperties": [
    "gts.frontx.mfes.comm.shared_property.v1~frontx.mfes.comm.theme.v1~",
    "gts.frontx.mfes.comm.shared_property.v1~frontx.mfes.comm.language.v1~"
  ],
  "actions": [
    "gts.frontx.mfes.comm.action.v1~frontx.mfes.ext.load_ext.v1~",
    "gts.frontx.mfes.comm.action.v1~frontx.mfes.ext.mount_ext.v1~"
  ],
  "extensionsActions": [],
  "extensionsTypeId": "gts.frontx.mfes.ext.extension.v1~frontx.screensets.layout.screen.v1~",
  "defaultActionTimeout": 30000,
  "lifecycleStages": [
    "gts.frontx.mfes.lifecycle.stage.v1~frontx.mfes.lifecycle.init.v1"
  ],
  "extensionsLifecycleStages": [
    "gts.frontx.mfes.lifecycle.stage.v1~frontx.mfes.lifecycle.init.v1",
    "gts.frontx.mfes.lifecycle.stage.v1~frontx.mfes.lifecycle.activated.v1",
    "gts.frontx.mfes.lifecycle.stage.v1~frontx.mfes.lifecycle.deactivated.v1",
    "gts.frontx.mfes.lifecycle.stage.v1~frontx.mfes.lifecycle.destroyed.v1"
  ]
}
